{
  "$schema": "./s950-calibration.schema.json",
  "id": "s950-calibration",
  "title": "Curvas de unidades del Akai S950",
  "description": "Las seis curvas que relacionan un valor de panel con su unidad real (segundos, Hz, octavas, dB), con la forma de cada eje. GENERADO desde SynthCore/S950Calibration.h, que es la fuente autoritativa. Los PUNTOS salen vacios y por decision: son resultados experimentales, y la tabla del estudio Mz950 que los tiene es AGPLv3. Un panel dibuja los ejes con esto y marca las curvas sin medir; no las inventa.",
  "generatedFrom": "ABDSharedCode/SynthCore/S950Calibration.h",
  "sourceOfTruth": "ABDSharedCode/SynthCore/S950Calibration.h",
  "notes": [
    "ESTE CONTRATO NO TIENE UN SOLO VALOR MEDIDO, y no es que falten: es la respuesta correcta a \"todavia nadie ha medido esto en este repo\". Lo que se declara es la FORMA, que sale del dominio del panel y es dato de formato; los puntos son una medicion, y medir es cosa de quien tenga la maquina.",
    "\"measured\": false y \"points\": [] estan EXPLICITOS, y \"measuredRange\" es null y no 0..99. Un panel tiene que poder ENSENAR que no lo sabe, y enseñarlo exige que \"no lo se\" sea distinguible de un cero: 0 s de attack no es lo mismo que un attack sin medir, es un click.",
    "Los puntos medidos viven en un vector que se llena en runtime, no en la tabla constexpr, asi que el generador no puede leerlos ni aunque quisiera. Cuando se midan, la tabla deja de ser la fuente y pasa a serlo el fichero de medicion; ese cambio tiene que actualizar generatedFrom.",
    "positiveOnly NO es lo mismo que logarithmic, aunque las dos se escriban juntas en la tabla. Los dB tienen eje logaritmico y admiten el 0 —0 dB es el nivel de referencia, no un instante— y el silencio de un sustain apagado es un valor legitimo. Un tiempo de cero si es un instante, y una envolvente de duracion cero es un click.",
    "allowExtrapolation es false en las seis. Un extremo que nadie ha medido es el que se rellena con una conjetura: el rapido se acaba antes de que la sonda lo vea, y el lento dura mas que la nota.",
    "risesWithStored es false en las curvas de tiempo y en la de dB, porque mas byte es MAS LENTO o MAS FUERTE, no mas valor. Es lo primero que se dibuja equivocado, porque el nombre del byte no lo dice."
  ],
  "curves": [
    {
      "code": "envelopeTime",
      "name": "Envelope time",
      "unit": "s",
      "axisLabel": "Attack / Decay / Release",
      "storedLo": 0,
      "storedHi": 99,
      "risesWithStored": false,
      "logarithmic": true,
      "positiveOnly": true,
      "allowExtrapolation": false,
      "measured": false,
      "pointCount": 0,
      "points": [],
      "measuredRange": null
    },
    {
      "code": "lfoRate",
      "name": "LFO rate",
      "unit": "Hz",
      "axisLabel": "LFO rate",
      "storedLo": 0,
      "storedHi": 99,
      "risesWithStored": true,
      "logarithmic": false,
      "positiveOnly": true,
      "allowExtrapolation": false,
      "measured": false,
      "pointCount": 0,
      "points": [],
      "measuredRange": null
    },
    {
      "code": "warpTime",
      "name": "Warp time",
      "unit": "s",
      "axisLabel": "Warp time",
      "storedLo": 0,
      "storedHi": 99,
      "risesWithStored": true,
      "logarithmic": true,
      "positiveOnly": true,
      "allowExtrapolation": false,
      "measured": false,
      "pointCount": 0,
      "points": [],
      "measuredRange": null
    },
    {
      "code": "filterCutoff",
      "name": "Filter cutoff",
      "unit": "Hz",
      "axisLabel": "Soft / Loud filter",
      "storedLo": 0,
      "storedHi": 99,
      "risesWithStored": true,
      "logarithmic": true,
      "positiveOnly": true,
      "allowExtrapolation": false,
      "measured": false,
      "pointCount": 0,
      "points": [],
      "measuredRange": null
    },
    {
      "code": "filterEnvOctaves",
      "name": "Filter env",
      "unit": "octaves",
      "axisLabel": "VCF amount",
      "storedLo": -50,
      "storedHi": 50,
      "risesWithStored": false,
      "logarithmic": false,
      "positiveOnly": false,
      "allowExtrapolation": false,
      "measured": false,
      "pointCount": 0,
      "points": [],
      "measuredRange": null
    },
    {
      "code": "sustainDb",
      "name": "Sustain level",
      "unit": "dB",
      "axisLabel": "Attack / Decay / Sustain",
      "storedLo": 0,
      "storedHi": 99,
      "risesWithStored": false,
      "logarithmic": true,
      "positiveOnly": false,
      "allowExtrapolation": false,
      "measured": false,
      "pointCount": 0,
      "points": [],
      "measuredRange": null
    }
  ]
}
